{
  "schema_version": "architecture-v1",
  "architecture_id": "toy_arch_001",
  "room_type": "bedroom",
  "coordinate_system": {
    "layout_plane": "xz",
    "vertical_axis": "y",
    "unit": "meter",
    "orientation_convention": {
      "zero_degree_axis": "+x",
      "positive_direction": "counter_clockwise",
      "unit": "degree"
    }
  },
  "coordinate_transforms": [
    {
      "transform_id": "xz_to_image_001",
      "from": "world_xz_meter",
      "to": "image_pixel",
      "image_size_px": [512, 512]
    }
  ],
  "boundary": {
    "polygon_m": [[0, 0], [4.2, 0], [4.2, 3.6], [0, 3.6]]
  },
  "anchors": [
    {
      "anchor_id": "wall_south",
      "anchor_type": "wall",
      "segment_m": [[0, 0], [4.2, 0]]
    },
    {
      "anchor_id": "door_001",
      "anchor_type": "door",
      "bbox_m": [1.7, 0.0, 2.5, 0.18],
      "swing": "inward"
    },
    {
      "anchor_id": "window_001",
      "anchor_type": "window",
      "bbox_m": [1.3, 3.45, 2.9, 3.6]
    },
    {
      "anchor_id": "door_001_clearance",
      "anchor_type": "clearance",
      "polygon_m": [[1.5, 0], [2.7, 0], [2.7, 1.0], [1.5, 1.0]]
    }
  ]
}

